,If you read,Recommendation 1,Recommendation 2,Recommendation 3,Recommendation 4,Recommendation 5
-5848755753905481990,"Incrível, Skype se lembrou que o Linux existe!",Alecrim/AlecrimCoreData,Java Tools and Technologies Landscape Report 2016 | zeroturnaround.com,Código Google: Introdução da próxima geração do Google Tag Manager e do Tag Manager 360 para Mobile Apps,"Tabs vs Spaces: How They Write Java at Google, Twitter, Mozilla and Pied Piper | Takipi Blog",Programação Reativa Funcional com RxJava
-5848514031542611523,Promoting gender equality through emoji �� ��,Criadas para casar,De piada sobre TPM a servir cafezinho: como lidar com machismo no trabalho?,#iLookLikeAnEngineer: One Year Later,A importância dos filmes de mulherzinha - Capitolina,"O meme 'Luiza, você está atenta?' explicou da melhor forma o machismo na área da tecnologia"
-5843518165523212471,A saga do jovem CEO da Dasa,"5 awesome Google Keep features you aren't using, but should be",The Difference Between Sympathy And Empathy - Expanded Consciousness,Governo brasileiro cria manual para contratação de cloud,Lean IT is all about people - o Lean na TI é focado em pessoas,"Google lança Science Journal, aplicativo de ciências para Android | Google Discovery"
-5813211845057621660,Communication patterns in a Microservice world,Arquitetura de Microserviços habilitando APIs - Sensedia,Twitter faz atualização em seu aplicativo Fabric para trazer mais funcionalidades às empresas e aos desenvolvedores de apps - Startupi,How to build cross-platform mobile apps using nothing more than a JSON markup,Hype Driven Development,The Ultimate Solution to Versioning REST APIs: Content Negotiation
-5784991738549272379,NodeMCU (ESP8266) o módulo que desbanca o Arduino e facilitará a Internet das Coisas...,One Dollar Board: Um projeto brasileiro para revolucionar a educação,11 Internet of Things (IoT) Protocols You Need to Know About,1º Congresso Brasileiro de IoT - Embarcados,Raspberry Pi with cloud vision at Google I/O - Raspberry Pi,The Physical Web
-5784228041033890044,[E-learning] Design Thinking for Innovation - University of Virginia | Coursera,"Google, Amazon and the upcoming battle over AI Assistants",[Article] Poka Yoke: o que é e como implementar | Endeavor Brasil,"5 awesome Google Keep features you aren't using, but should be","Feather: A Fast On-Disk Format for Data Frames for R and Python, powered by Apache Arrow",The Difference Between Sympathy And Empathy - Expanded Consciousness
-5778988730475305016,Artificial intelligence is changing SEO faster than you think,The barbell effect of machine learning.,This Super Accurate Portrait Selection Tech Uses Neural Networks,WWDC 2016 preview: How to watch &amp; what to expect at Apple's event on Monday,Lists are the new search,Up your app's sharing game with DirectShare - Google Developers
-5756697018315640725,Being A Developer After 40 - Free Code Camp,Accidental discovery could help batteries last years longer,The Children's Illustrated Guide to Kubernetes,Google researchers teach AIs to see the important parts of images - and tell you about them,"Margaret Gould Stewart: How giant websites design for you (and a billion others, too)",Measuring email effectiveness in retail banking
-5736221996280340620,How Coca-Cola Is Harvesting Innovation Energy From Startups,7 Vital SEO Trends for Google Rankings in 2017 | Digital Current,"Coca-Cola é 1ª da lista ""Fortune"" a repor toda a água usada | EXAME.com","Have a Coke, take a photo and celebrate the Coke bottle's 100th anniversary using How-Old.net",Coca-Cola Is Paying $575 Million for Unilever's Soy Drink Business,O manual do deboísta corporativo
-5684357871122991503,MOBILE TIME - Youse: seguradora digital se diferencia através da interface móvel,The surprising truth about which countries lead in digital,A digital crack in banking's business model,How will bots make money? Here are 7 business models,Speeding up ReSharper (and Visual Studio),So you want to sell to banks?
-5658245291907121574,Machine Learning and the VP Debate,The AI business landscape,5 reasons your employees aren't sharing their knowledge,Google's Cloud Machine Learning service is now in public beta,"Hello, TensorFlow!","Bots, Messenger and the future of customer service"
-5636731245639685654,Especial Agrishow: Soluções de agricultura de precisão elevam produtividade e aumentam a qualidade do plantio,Creating value in auto finance with vLendRight | Kevin Moseri,Goodbye accountants! Startup builds AI to automate all your accounting,How to Create an Exponential Mindset,Algorithms and architecture for job recommendations,This startup uses machine learning and satellite imagery to predict crop yields
-5628897645967553681,The Genderbread Person v3 | It's Pronounced Metrosexual,YouTube chama seus criadores de conteúdo para a campanha mundial #OrgulhoDeSer,Workplace diversity in Brazil: there's still a long way to go,"TRF mantém resolução que proíbe ""cura gay"" - Jornal Opção",O chefe é gay. E daí?,Este site quer conectar profissionais trans e travestis a empresas que não têm preconceito
-5625593730080264433,The next wave in software is open adoption software,Microsoft's Open Source Love Affair Reaches New Heights,Bot Design Patterns,"Google Slides incorpora recurso de ""perguntas e respostas"" em tempo real | Google Discovery",Bradesco vai lançar novo banco digital: o Next.,Our password hashing has no clothes
-5605799891597699962,Concrete things you can do about your technical debt,Java Microservices: The Cake is a Lie but You Can't Ignore It | Takipi Blog,Google's cloud platform is now a force to be reckoned with,How Coca-Cola Is Harvesting Innovation Energy From Startups,Test and deploy to Google App Engine with the new Maven and Gradle plugins,7 Vital SEO Trends for Google Rankings in 2017 | Digital Current
-5571606607344218289,Agile: Falta competência nos testes,Testes unitários vs aceitação - Android Dev BR,Como o layout de aplicativos influencia o usuário e por que você deveria testá-lo - One Day Testing Blog,Sua comunidade de Teste.,Top 5 Android Testing Frameworks with Examples,Como Usar o Git e o GitHub
-5570129644089964821,Design Kit: Prototyping,Bradesco vai testar tecnologia por trás do bitcoin em São Paulo,Visa lança desafio para startups de tecnologia - Startupi,Banco desafia empreendedores e estudantes de tecnologia a buscarem inovação para processos | EXAME.com,Is FinTech Forcing Banking to a Tipping Point?,MOBILE TIME - Shoppings do Rio testarão solução de marketing com beacons
-5515204090203464377,A step-by-step guide to agile growth experiments,The sales secrets of high-growth companies,An operating model for company-wide agile development,Is FinTech Forcing Banking to a Tipping Point?,Do you want Crappy Agile?,You won't recognize the new world of digital payments without this report
-5507019982244746725,What to Inspect When You are Inspecting!,Serverless Architectures,Google is testing a new Material Design layout for desktop searches,Decentralizing IoT networks through blockchain,The Netflix Tech Blog: Netflix Billing Migration to AWS,Docker 1.12: Now with Built-in Orchestration!
-5488842573681626972,BDD Best Practices and Guidelines - Testing Excellence,Como Usar o Git e o GitHub,Dicas avançadas de ruby (capybara/cucumber),Sua comunidade de Teste.,Assista a entrevista de Linus Torvalds no TED legendada,Agile: Falta competência nos testes
-5446204508747882127,bliki: StranglerApplication,On DRY and the cost of wrongful abstractions,Standing on the Shoulders of Giants - Built to Adapt,Mobify report reveals impact of mobile website speed,Java 9 na prática: Jigsaw,Closure Compiler in JavaScript
-5414889822782394955,6 exemplos de como usar computação cognitiva | EXAME.com,MOBILE TIME - Shoppings do Rio testarão solução de marketing com beacons,Visa lança desafio para startups de tecnologia - Startupi,Pesquisadores do MIT desenvolvem tecnologia que digitaliza livros fechados - Geek,Is FinTech Forcing Banking to a Tipping Point?,"Google anuncia Android Things, plataforma para a Internet das Coisas | Google Discovery"
-5410531116380081703,Meet the new Brazilian consumer,The economic essentials of digital strategy,You won't recognize the new world of digital payments without this report,PwC faz virada digital e já fatura US$ 1 bilhão no mundo,Accenture amplia atuação no Brasil,Meio&Mensagem
-5403733687257676872,Aplicações da Inteligência artificial | Endeavor Brasil,Machine Learning and the VP Debate,Ouça a música criada pela inteligência artificial do Google | Google Discovery,The AI business landscape,"How Google is Remaking Itself as a ""Machine Learning First"" Company - Backchannel",Google's Cloud Machine Learning service is now in public beta
-5380376324140474506,Mudanças na App Store podem não conquistar desenvolvedores | EXAME.com,"Autofill: What web devs should know, but don't",WWDC 2016 preview: How to watch &amp; what to expect at Apple's event on Monday,Joel on Software,The barbell effect of machine learning.,Lists are the new search
-5363263367015469934,Scala is the new golden child,7 Questions to Ask Before Your Next Digital Transformation,Programming by poking: why MIT stopped teaching SICP,"DARPA Goes ""Meta"" with Machine Learning for Machine Learning",6 reasons why I like KeystoneML,Aprendizado de máquina do Google pode detectar retinopatia diabética | Google Discovery
-5283011611531067471,Dries Distributions remain a growing opportunity for Drupal - Buytaert,Meet Aquifer: A build system for easier Drupal development,Lightning Distribution for Drupal: Build Advanced Authoring Experiences in Drupal 8,Johnson & Johnson comprará grupo suíço por US$ 30 bi,Dries Buytaert,The Death of Drupal Commerce as an Ecommerce Solution - Third & Grove
-5283009029345397378,Microservices Architecture on Google App Engine,Building Flipkart Lite: A Progressive Web App,Building a Team from the Inside Out: Alok Gupta on the Evolution of Data Science at Airbnb,Why Kubernetes may be a bigger threat to Amazon than Google's cloud - TechRepublic,SOA com microserviços - Sensedia,The five phases of migrating to Google Cloud Platform
-5255285107284514595,Como a Microsoft está trabalhando com o conceito de IoT - Startupi,Wide & Deep Learning: Better Together with TensorFlow,"Facebook Workplace officially launches on the web and iOS, set to compete head-on with Slack",Text summarization with TensorFlow,Ordering coffee in Italy: the 10 commandments,Shopping app Spring's redesign could be a game-changer
-5253644367331262405,"Hello, TensorFlow!",Power to the People: How One Unknown Group of Researchers Holds the Key to Using AI to Solve Real...,Google's Cloud Machine Learning service is now in public beta,The AI business landscape,"DARPA Goes ""Meta"" with Machine Learning for Machine Learning","How Google is Remaking Itself as a ""Machine Learning First"" Company - Backchannel"
-5198756378866433953,Who sponsors Drupal development? | Dries Buytaert,"Salesforce buys Demandware for $2.8B, taking a big step into e-commerce",The return of the machinery question,Dries Distributions remain a growing opportunity for Drupal - Buytaert,Acquia Engage Awards Finalists Announced,Google is quietly recording everything you say. Here's how to hear it
-5193720747719231594,#FinTech is all about human-centred design - Chris Skinner's blog,Accenture amplia atuação no Brasil,The Drive to Bank on Digital,A identidade visual de Budapeste para as Olimpíadas de 2024,The compelling case to replace a 40-year old core system - Chris Skinner's blog,Campus São Paulo: conheça a primeira turma do Programa de Residentes
-5161313513317812402,"Meet Bozoma Saint John, the Apple executive who stole the show at WWDC","Para rebater Estatuto da Família, campanha muda significado de 'família' no Dicionário Houaiss",Netflix emociona com vídeo destacando personagens LGBT,"If women in tech stop apologizing, we might just be able to shut the sexist shit down. - Athena Talks","The code that took America to the moon was just published to GitHub, and it's like a 1960s time capsule",Susan Wojcicki on the Effectiveness of Empowering Ads on YouTube
-5154395767417065070,Innovation is in all the wrong places,Design Sprint: onde o design e a velocidade importam,We are on the verge of a consumer M&A avalanche,Why Netflix thinks its personalized recommendation engine is worth $1 billion per year,Here's proof that Google is getting serious about battling Facebook in a key area,Facebook is open-sourcing its AI bot-building research
-5148591903395022444,Anti-If: The missing patterns,Ubuntu recebe suporte ao React Native e aplicativos de Android e iOS poderão chegar ao sistema,What Color is Your Function?,"Autofill: What web devs should know, but don't",Sam Newman - Backends For Frontends,Berners-Lee quer criar outra Web
-5088157426675091741,Dez habilidades profissionais mais valorizadas em projetos de Internet das Coisas - CIO,11 Internet of Things (IoT) Protocols You Need to Know About,Google's Cloud Machine Learning service is now in public beta,Using behavioral data to improve customer satisfaction,Uma arquitetura de referência para a Internet das Coisas - Parte 1,Aplicativos do Android agora podem reagir com o ambiente | Google Discovery
-5065077552540450930,Ranking das maiores seguradoras da Europa - 2015 | Sonho Seguro,Liberty vai adotar telemetria e baratear seguro para bons motoristas,Porto Seguro compra carteira de seguros Auto da Chubb,MOBILE TIME - Shoppings do Rio testarão solução de marketing com beacons,The economic essentials of digital strategy,Visa lança desafio para startups de tecnologia - Startupi
-5044204125574973395,Samsung lança dispositivo para deixar carro conectado a partir de chip 4G - Link - Estadão,How to Create an Exponential Mindset,Goodbye accountants! Startup builds AI to automate all your accounting,Creating value in auto finance with vLendRight | Kevin Moseri,Especial Agrishow: Soluções de agricultura de precisão elevam produtividade e aumentam a qualidade do plantio,Algorithms and architecture for job recommendations
-5039153034159656707,Mercado de Cosméticos no Brasil - Setor que não conhece crise!,Não existe frete grátis!,From E-Commerce to Web 3.0: Let the Bots Do the Shopping,Startups matam. E suas vítimas são as empresas que ainda não entendem o que é a Economia do Acesso,"Como o e-commerce brasileiro pode, enfim, começar a lucrar",Pão de Açúcar tem rombo de R$ 512 milhões com fraude em e-commerce
-5037827401452845772,Quando o Scrum irá falhar - Tableless,Accidental discovery could help batteries last years longer,"Create Intelligent, Context-Aware Apps with the Google Awareness APIs | Android Developers Blog",Iniciando com o Docker: Criando suas próprias imagens - Tableless,Bots won't replace apps. Better apps will replace apps.,Bitbucket Pipelines Beta: continuous delivery inside Bitbucket - Bitbucket
-5014627593450767720,Drupal and ambitious digital experiences,Why Is Learning Drupal Hard?,Hacked Website Report - 2016/Q3,Cross-channel user experiences with Drupal,The Death of Drupal Commerce as an Ecommerce Solution - Third & Grove,Dries Distributions remain a growing opportunity for Drupal - Buytaert
-5011709367955107239,"Vale reverte prejuízo e tem lucro de R$ 1,8 bilhão no 3º trimestre",Conselho da SABMiller aceita proposta de compra da AB InBev,Ultrapar aprova investimento adicional de R$ 196 milhões para a Ipiranga,Elasticsearch: CSV exporter for Kibana Discover,Gartner Reprint,Startups apostam em aplicativos que conectam fretes e caminhoneiros
-5002383425685129595,Changing change management,How to Create an Exponential Mindset,Creating value in auto finance with vLendRight | Kevin Moseri,Goodbye accountants! Startup builds AI to automate all your accounting,Algorithms and architecture for job recommendations,Especial Agrishow: Soluções de agricultura de precisão elevam produtividade e aumentam a qualidade do plantio
-4996336942690402156,Live asynchronously.,Google lança experimentos com inteligência artificial | Google Discovery,Burger King aceita pedidos via mensagens no Facebook - Startupi,Introduction · Bitcoin para Programadores,Um bilhão de arquivos mostram quem vence a disputa tabs vs. espaços entre programadores,How it feels to learn Javascript in 2016
-4974757204495953627,Alecrim/AlecrimCoreData,Microsoft's Open Source Love Affair Reaches New Heights,Apple anuncia a 3ª geração da linguagem Swift para o final deste ano,Why porting an iOS design to Android will not work,"Incrível, Skype se lembrou que o Linux existe!",Google is testing a new Material Design layout for desktop searches
-4944551138301474550,Algorithms and architecture for job recommendations,Goodbye accountants! Startup builds AI to automate all your accounting,"How to forecast demand with Google BigQuery, public datasets and TensorFlow | Google Cloud Big Data and Machine Learning Blog",Creating value in auto finance with vLendRight | Kevin Moseri,This startup uses machine learning and satellite imagery to predict crop yields,Google acquires deep search engine Kifi to enhance its Spaces group chat app
-4888170580455425266,Speeding up ReSharper (and Visual Studio),MOBILE TIME - Youse: seguradora digital se diferencia através da interface móvel,'We've realized a ten-year strategy goal in one year',Microservices - When to React Vs. Orchestrate - Capital One DevExchange,O que o GitHub tem a nos dizer sobre os estereótipos entre programadores | Tecnoblog,Como são escrita as risadas em japonês? - Suki Desu
-4875060556471576861,Jenkins 2.0 is here!,The Netflix Tech Blog: Engineering Trade-Offs and The Netflix API Re-Architecture,My experience with Google's Associate Android Developer Certification,Announcing SyntaxNet: The World's Most Accurate Parser Goes Open Source,VMware Cloud™ on AWS - A Closer Look - frankdenneman.nl,Modelando APIs REST com Swagger
-4831310174172854034,Standing on the Shoulders of Giants - Built to Adapt,"Kotlin in Production - What works, Whats broken",Combining Spring Boot and JDBI,Cubr,Building Spring Cloud Microservices That Strangle Legacy Systems,bliki: StranglerApplication
-4798431998955209742,What Color is Your Function?,Sam Newman - Backends For Frontends,Ubuntu recebe suporte ao React Native e aplicativos de Android e iOS poderão chegar ao sistema,WWDC 2016 preview: How to watch &amp; what to expect at Apple's event on Monday,Robert Waldinger: Do que é feita uma vida boa? Lições do mais longo estudo sobre felicidade,The barbell effect of machine learning.
-4765711818183276269,Google lags behind Amazon and Microsoft's cloud in one important area,Google's Cloud Dataflow stomps on Apache Spark in new benchmark tests,"An independent organization just ranked Google as the best cloud, beating Amazon",5 Unique Features Of Google Compute Engine That No IaaS Provider Could Match,"BigQuery 1.11, now with Standard SQL, IAM, and partitioned tables! | Google Cloud Big Data and Machine Learning Blog",Text summarization with TensorFlow
-4754223659064624252,Effective learning through code workshops | Box Blog,"Facebook Workplace officially launches on the web and iOS, set to compete head-on with Slack",Text summarization with TensorFlow,"Bots, Messenger and the future of customer service",Wide & Deep Learning: Better Together with TensorFlow,Como a Microsoft está trabalhando com o conceito de IoT - Startupi
-4700714777342103147,"Say goodbye to traditional customer segmentation "" Banking Technology",Power to the People: How One Unknown Group of Researchers Holds the Key to Using AI to Solve Real...,"DARPA Goes ""Meta"" with Machine Learning for Machine Learning",Programming by poking: why MIT stopped teaching SICP,Facebook is open-sourcing its AI bot-building research,It's The Future
-4655195825208522542,Java 9 na prática: Jigsaw,Lessons from converting an app to 100% Kotlin - Keepsafe Engineering,On DRY and the cost of wrongful abstractions,My favorite people and resources to learn Android programming from,bliki: StranglerApplication,"Netflix OSS, Spring Cloud, or Kubernetes? How About All of Them!"
-4625438649010928449,Top Asset Tracking Software: The 52 Best Tools and Software Solutions to Track Your Company's Vital Physical Assets,Startups apostam em aplicativos que conectam fretes e caminhoneiros,Conselho da SABMiller aceita proposta de compra da AB InBev,Goodbye accountants! Startup builds AI to automate all your accounting,Creating value in auto finance with vLendRight | Kevin Moseri,Twitter faz atualização em seu aplicativo Fabric para trazer mais funcionalidades às empresas e aos desenvolvedores de apps - Startupi
-4509487968959834430,O valor de seu trabalho de coaching vai depender de suas habilidades de acompanhamento - Harvard Business Review Brasil,Chat Smarter with Allo,"Para neurociência, motivação não é fator principal em mudança de hábitos",Scrum Community - Scrum Alliance,How to augment your career with leadership coaching,"Ser um bom líder depende de inúmeros fatores. Mas um deles, segundo o inglês Simon Sinek, é importantíssimo: a coragem para proteger as equipes e para arriscar quando necessário"
-4503975842879662368,Google Ranking Factors: The Complete List,Introduction to Natural Language Processing - University of Michigan | Coursera,"Novo workaholic trabalha, pratica esportes e tem tempo para a família. Conheça",Stop saying learning to code is easy.,A minha viagem à Maternidade #tetodomundo,Livro: Retrospectivas Divertidas
-4487024160266973763,Visa inaugura Co-Creation Center em São Paulo,Visa lança desafio para startups de tecnologia - Startupi,Banco desafia empreendedores e estudantes de tecnologia a buscarem inovação para processos | EXAME.com,MOBILE TIME - Shoppings do Rio testarão solução de marketing com beacons,Is FinTech Forcing Banking to a Tipping Point?,Novas frentes de trabalho da Alelo vão de ações de fidelidade a novos meios de pagamento
-4460374799273064357,"Deep Learning for Chatbots, Part 1 - Introduction",WeChat's competitor to Slack has arrived,Why Is Learning Drupal Hard?,WeChat's world,Multi-Channel Marketing in 2015 - It's not rocket science.,"Deep Learning for Chatbots, Part 2 - Implementing a Retrieval-Based Model in Tensorflow"
-4386371945374980231,Por que o Walmart não é Walmart no Brasil,Mercado de Cosméticos no Brasil - Setor que não conhece crise!,Não existe frete grátis!,As compras e os hábitos dos brasileiros no shopping | EXAME.com,Cia. Hering sincroniza diferentes marcas em um único portal de compras,From E-Commerce to Web 3.0: Let the Bots Do the Shopping
-4358357193736101128,Uma arquitetura de referência para a Internet das Coisas - Parte 1,Announcing .NET Core 1.0,Acesse a versão Material Design do YouTube | Google Discovery,JavaScript Conquered the Web. Now It's Taking Over the Desktop,Google lança experimentos com inteligência artificial | Google Discovery,How I sped up the initial render of my Polymer app by 86%
-4338308747999225618,How the queen of Silicon Valley is helping Google go after Amazon's most profitable business,An operating model for company-wide agile development,Staying one step ahead at Pixar: An interview with Ed Catmull,An operating model for company-wide agile development,Mobile banking conquista o coração dos brasileiros,Big IT Rising
-4336877432539963613,Comparing IoT Platforms: Compare 4 IoT platform for IoT projects,11 Internet of Things (IoT) Protocols You Need to Know About,1º Congresso Brasileiro de IoT - Embarcados,One Dollar Board: Um projeto brasileiro para revolucionar a educação,Aplicativos do Android agora podem reagir com o ambiente | Google Discovery,Smart Contact Lens-Eyeglass Combo Could Monitors Diabetes and Delivers Drugs
-4333957157636611418,Why Programmers Want Private Offices,The hardest thing in computer science,Things you probably didn't know you could do with Chrome's Developer Console,Nubank e Goldman fecham parceria de R$ 200 milhões,Lessons from converting an app to 100% Kotlin - Keepsafe Engineering,My favorite people and resources to learn Android programming from
-4333056764244640444,Lentes de contato inteligentes serão o wearable definitivo,How to finish 3D printed PLA objects,Peças Translúcidas,Smart Contact Lens-Eyeglass Combo Could Monitors Diabetes and Delivers Drugs,Raspberry Pi with cloud vision at Google I/O - Raspberry Pi,Ouça a música criada pela inteligência artificial do Google | Google Discovery
-4278025512576376201,#Sentaquelávemtextão,Workplace diversity in Brazil: there's still a long way to go,O dia em que tive mais medo de estar errada.,"If women in tech stop apologizing, we might just be able to shut the sexist shit down. - Athena Talks",As expectativas das mulheres da Geração Y são muitas,"Meet Bozoma Saint John, the Apple executive who stole the show at WWDC"
-4233177915193302509,Governo brasileiro cria manual para contratação de cloud,Especial: O papel dos grandes provedores de TI na Rio 2016,Mobile marketing statistics 2016,"5 awesome Google Keep features you aren't using, but should be","No, Apple isn't the next BlackBerry - it's the next Microsoft",Latin America's chronic inefficiency could drive more O2O commerce growth
-4228415104574264137,Up your app's sharing game with DirectShare - Google Developers,Lists are the new search,The barbell effect of machine learning.,Designing smart notifications,This Super Accurate Portrait Selection Tech Uses Neural Networks,WWDC 2016 preview: How to watch &amp; what to expect at Apple's event on Monday
