,If you read,Recommendation 1,Recommendation 2,Recommendation 3,Recommendation 4,Recommendation 5
-667193404227875686,The Drive to Bank on Digital,#FinTech is all about human-centred design - Chris Skinner's blog,The compelling case to replace a 40-year old core system - Chris Skinner's blog,A identidade visual de Budapeste para as Olimpíadas de 2024,Banco desafia empreendedores e estudantes de tecnologia a buscarem inovação para processos | EXAME.com,Mary Meeker's essential 2016 Internet Trends Report
-655909700262679295,Banco desafia empreendedores e estudantes de tecnologia a buscarem inovação para processos | EXAME.com,Visa lança desafio para startups de tecnologia - Startupi,MOBILE TIME - Shoppings do Rio testarão solução de marketing com beacons,Design Kit: Prototyping,Novas frentes de trabalho da Alelo vão de ações de fidelidade a novos meios de pagamento,Is FinTech Forcing Banking to a Tipping Point?
-615912190028612956,"Ser um bom líder depende de inúmeros fatores. Mas um deles, segundo o inglês Simon Sinek, é importantíssimo: a coragem para proteger as equipes e para arriscar quando necessário",What Science Tells Us About Leadership Potential,Chat Smarter with Allo,Scrum Community - Scrum Alliance,The surprising truth about which countries lead in digital,Mobile marketing statistics 2016
-601952361752157430,Cannes Lions 2016: Tecido tecnológico do Google leva GP de Product Design,Burger King aceita pedidos via mensagens no Facebook - Startupi,Text summarization with TensorFlow,Google lança experimentos com inteligência artificial | Google Discovery,The real reasons you procrastinate - and how to stop,Bose's New Speaker Only Costs $150 But You Have to Build It Yourself
-559964548932224920,Jeff Seguros: SEGUROS E GAMES,Porto Seguro compra carteira de seguros Auto da Chubb,Ouça a música criada pela inteligência artificial do Google | Google Discovery,Machine Learning and the VP Debate,Brazil's Banco Bradesco Joins R3 Consortium - CoinDesk,Google adiciona medidor de velocidade da internet nos resultados de pesquisa | Google Discovery
-555187669877280641,Introduction to Natural Language Processing - University of Michigan | Coursera,"How Google is Remaking Itself as a ""Machine Learning First"" Company - Backchannel",Blaise Agüera y Arcas: How computers are learning to be creative,"Hello, TensorFlow!",Artificial intelligence is changing SEO faster than you think,"Netflix says Geography, Age, and Gender are ""Garbage"" for Predicting Taste"
-548976469460064550,Using Honcho to Create a Multi-Process Docker Container,"Docker - Build, Ship, and Run Any App, Anywhere",Introducing LambCI - a serverless build system,Par de alianças impede que seu parceiro assista Netflix sem você,Nova regra do Banco Central pode significar o fim do Nubank; entenda - IDG Now!,"DevOps security requires new mindset and tools for visibility, automation"
-541666025693385823,Calm down: Google's use of Material Design on iOS is fine,WWDC 2016 preview: How to watch &amp; what to expect at Apple's event on Monday,Designing smart notifications,Lists are the new search,The barbell effect of machine learning.,"The New App Store: Subscription Pricing, Faster Approvals, and Search Ads"
-538948733779286129,The Physical Web,Why porting an iOS design to Android will not work,"Bots, Messenger and the future of customer service",What is WebAssembly? The Dawn of a New Era - JavaScript Scene,NodeMCU (ESP8266) o módulo que desbanca o Arduino e facilitará a Internet das Coisas...,The Internet of Things is looking for its VisiCalc
-486686184692655504,New settings for 2-Step Verification,Rating the English Proficiency of Countries and Industries Around the World,Why Evernote Is Giving Up on Its Data Centers for Google Cloud,Susan Wojcicki on the Effectiveness of Empowering Ads on YouTube,#Sentaquelávemtextão,How the queen of Silicon Valley is helping Google go after Amazon's most profitable business
-447851796385928420,MOBILE TIME - FlyHelo: app permite compartilhamento de jatos e helicópteros em São Paulo,"No Brasil, '25% dos celulares ainda são 'Burrofones'","No, Apple isn't the next BlackBerry - it's the next Microsoft",Latin America's chronic inefficiency could drive more O2O commerce growth,Can Accenture Take Over Advertising?,"""Consultorias promovem a desvalorização do nosso negócio"" - Meio & Mensagem"
-401664538366009049,Pinterest's Real-World Pins Let In-Store Shoppers Save Real Items to Virtual Boards,Top 10 Intranet Trends of 2016,Meet the new Brazilian consumer,The economic essentials of digital strategy,2 terrific #MarTech talks on the rise of AI in marketing - Chief Marketing Technologist,Google is quietly recording everything you say. Here's how to hear it
-387651900461462767,Android irá recomendar aplicativos baseado na localização | Google Discovery,"Fresco, sim! - Android Dev BR",Cracking the Job Interview with TensorFlow,Why porting an iOS design to Android will not work,Decentralizing IoT networks through blockchain,"Bots, Messenger and the future of customer service"
-377975173223377441,"DARPA Goes ""Meta"" with Machine Learning for Machine Learning",Power to the People: How One Unknown Group of Researchers Holds the Key to Using AI to Solve Real...,"Hello, TensorFlow!","Say goodbye to traditional customer segmentation "" Banking Technology",Programming by poking: why MIT stopped teaching SICP,The AI business landscape
-360529647164834348,Código Limpo - Está na hora de deixar o GDD (Gambiarra Driven Development) para trás!,Itaú segue tendência das fintechs e se torna primeiro banco tradicional a permitir abertura de contas por app - Startupi,Designer Creates 13 Perfect Circles to Draw Almost Any Animal,You don't talk about refactoring club,Como consumir conteúdo de qualidade em iOS - CocoaHeads BR,Quando o Scrum irá falhar - Tableless
-348408475077850711,Introduction to release engineering,Beyond Progressive Web Apps Part 1,The barbell effect of machine learning.,Google I/O 2016: Android's failure to innovate hands a Apple free run at WWDC,WWDC 2016 preview: How to watch &amp; what to expect at Apple's event on Monday,This Super Accurate Portrait Selection Tech Uses Neural Networks
-330801551666885085,"AWS vs Packet.net Why we left AWS Benchmarking AWS's Network, Disk, and CPU Performance - Tiingo Thoughts",WWDC 2016 preview: How to watch &amp; what to expect at Apple's event on Monday,Joel on Software,Lists are the new search,The barbell effect of machine learning.,Design Patterns: Progressive Disclosure for Mobile Apps
-307396946333196366,Cracking the Job Interview with TensorFlow,Python Is Not Java (dirtSimple.org),"Netflix OSS, Spring Cloud, or Kubernetes? How About All of Them!","Bots, Messenger and the future of customer service",Why porting an iOS design to Android will not work,Android irá recomendar aplicativos baseado na localização | Google Discovery
-271938775771328391,Startups apostam em aplicativos que conectam fretes e caminhoneiros,Top Asset Tracking Software: The 52 Best Tools and Software Solutions to Track Your Company's Vital Physical Assets,Ultrapar aprova investimento adicional de R$ 196 milhões para a Ipiranga,Conselho da SABMiller aceita proposta de compra da AB InBev,Gartner Reprint,"Vale reverte prejuízo e tem lucro de R$ 1,8 bilhão no 3º trimestre"
-240359174314633445,Comparing React.js to Vue.js for dynamic tabular data,Santander Vies to Become First Bank to Issue Cash on Blockchain - CoinDesk,"A whole new GitHub Universe: announcing new tools, forums, and features",Ubuntu recebe suporte ao React Native e aplicativos de Android e iOS poderão chegar ao sistema,Quick Tip: Working with the JavaScript Battery API,CSS Containment in Chrome 52 | Web Updates - Google Developers
-205193648629294862,Is FinTech Forcing Banking to a Tipping Point?,The sales secrets of high-growth companies,Why the customer experience matters,Visa lança desafio para startups de tecnologia - Startupi,You won't recognize the new world of digital payments without this report,PwC faz virada digital e já fatura US$ 1 bilhão no mundo
-170687954910264210,As compras e os hábitos dos brasileiros no shopping | EXAME.com,From E-Commerce to Web 3.0: Let the Bots Do the Shopping,Vendas da Netshoes crescem 267% em dispositivos móveis no 1º semestre - 24Brasil,Mercado de Cosméticos no Brasil - Setor que não conhece crise!,Cia. Hering sincroniza diferentes marcas em um único portal de compras,Não existe frete grátis!
-133139342397538859,"Novo workaholic trabalha, pratica esportes e tem tempo para a família. Conheça",Livro: Retrospectivas Divertidas,O dia em que tive mais medo de estar errada.,Introduction to release engineering,Ray Kurzweil: The world isn't getting worse - our information is getting better,"If women in tech stop apologizing, we might just be able to shut the sexist shit down. - Athena Talks"
-78667914647336721,Build Quality In: The Key to Continuous Delivery in Kanban,Rating the English Proficiency of Countries and Industries Around the World,Google Cloud Platform sets a course for new horizons,Scrum Community - Scrum Alliance,"Ser um bom líder depende de inúmeros fatores. Mas um deles, segundo o inglês Simon Sinek, é importantíssimo: a coragem para proteger as equipes e para arriscar quando necessário",Why Evernote Is Giving Up on Its Data Centers for Google Cloud
-78066964941874046,Microservices testing,You SHOULD Learn Vanilla JavaScript Before JS Frameworks - Snipcart,SOA com microserviços - Sensedia,"How to build a robot that ""sees"" with $100 and TensorFlow",Building Flipkart Lite: A Progressive Web App,Building a Team from the Inside Out: Alok Gupta on the Evolution of Data Science at Airbnb
-42126282997118624,Programa de Demissão Voluntária na Moto Honda tem mais de 500 adesões,Agronegócio mantém crescimento com tecnologia - inova.jor,Bayer propõe comprar Monsanto para formar a maior agroquímica do mundo,Aplicativo gratuito permite gerenciar Consórcio Honda diretamente do celular - Notícias - Auto Estrada,"Carne artificial acabará com o agronegócio brasileiro, afirma especialista",Este texto do Ranieri é a melhor coisa que você lerá hoje
-21036008762564671,The sales secrets of high-growth companies,Is FinTech Forcing Banking to a Tipping Point?,You won't recognize the new world of digital payments without this report,Visa lança desafio para startups de tecnologia - Startupi,MOBILE TIME - Shoppings do Rio testarão solução de marketing com beacons,Banco desafia empreendedores e estudantes de tecnologia a buscarem inovação para processos | EXAME.com
-14569272361926584,Java 8 Streams - A Deeper Approach About Performance Improvement,Discutindo Devops na Prática,Mastering Bash and Terminal,Java Garbage Collection Essencial,Java 8 Streams : 10 missing features,When to make a Git Commit
-7527881206365368,De piada sobre TPM a servir cafezinho: como lidar com machismo no trabalho?,O que é liderança? Liderança é fazer a diversidade funcionar.,Não ao preconceito! ONU celebra Dia da Visibilidade de Mulheres Lésbicas e Bissexuais,Promoting gender equality through emoji �� ��,"If you think women in tech is just a pipeline problem, you haven't been paying attention - Tech Diversity Files",Workplace diversity in Brazil: there's still a long way to go
-6457517220721978,Agronegócio mantém crescimento com tecnologia - inova.jor,Bayer propõe comprar Monsanto para formar a maior agroquímica do mundo,Programa de Demissão Voluntária na Moto Honda tem mais de 500 adesões,"Carne artificial acabará com o agronegócio brasileiro, afirma especialista",Aplicativo gratuito permite gerenciar Consórcio Honda diretamente do celular - Notícias - Auto Estrada,Este texto do Ranieri é a melhor coisa que você lerá hoje
-5924996404988010,"Google lança Science Journal, aplicativo de ciências para Android | Google Discovery",Evernote anuncia integração com Google Drive | Google Discovery,"5 awesome Google Keep features you aren't using, but should be",Aplicativos do Android agora podem reagir com o ambiente | Google Discovery,Google is quietly recording everything you say. Here's how to hear it,Here's proof that Google is getting serious about battling Facebook in a key area
-1523691178084871,Measuring email effectiveness in retail banking,"Margaret Gould Stewart: How giant websites design for you (and a billion others, too)",Nubank começa a testar seu programa de fidelidade - Empresas Tech,Google researchers teach AIs to see the important parts of images - and tell you about them,Accidental discovery could help batteries last years longer,Will blockchain drive the fourth Industrial Revolution?
-1038011342017850,Para entender o Dia Internacional contra a Homofobia,O dia em que tive mais medo de estar errada.,"TRF mantém resolução que proíbe ""cura gay"" - Jornal Opção","If women in tech stop apologizing, we might just be able to shut the sexist shit down. - Athena Talks",Netflix emociona com vídeo destacando personagens LGBT,"Meet Bozoma Saint John, the Apple executive who stole the show at WWDC"
18930987176089166,10 Multipurpose Material Design Themes to Make Your Projects 10 Times Better,Twitter faz atualização em seu aplicativo Fabric para trazer mais funcionalidades às empresas e aos desenvolvedores de apps - Startupi,The Business Case for Progressive Web Apps,Designer Creates 13 Perfect Circles to Draw Almost Any Animal,Itaú segue tendência das fintechs e se torna primeiro banco tradicional a permitir abertura de contas por app - Startupi,Bringing easy and fast checkout with Payment Request API | Web Updates - Google Developers
39554158227241538,Campus São Paulo: conheça a primeira turma do Programa de Residentes,Accenture amplia atuação no Brasil,#FinTech is all about human-centred design - Chris Skinner's blog,The new tech talent you need to succeed in digital,MOBILE TIME - FlyHelo: app permite compartilhamento de jatos e helicópteros em São Paulo,Machine Learning Is At The Very Peak Of Its Hype Cycle - ARC
90383487344892230,Building Spring Cloud Microservices That Strangle Legacy Systems,Standing on the Shoulders of Giants - Built to Adapt,Visa inaugura centro para inovação em pagamento digital | EXAME.com,bliki: StranglerApplication,Internet of Things Drives Outcome-Based Business Models,gotwarlost/istanbul
127799031949294618,Apple Releases First Preview of Swift 3.0 for Developers,Apple anuncia a 3ª geração da linguagem Swift para o final deste ano,WWDC 2016 preview: How to watch &amp; what to expect at Apple's event on Monday,"The New App Store: Subscription Pricing, Faster Approvals, and Search Ads",Design Patterns: Progressive Disclosure for Mobile Apps,Announcing .NET Core 1.0
139485217095648183,Supercharge Java Auth with JSON Web Tokens (JWTs) | Baeldung,"Tabs vs Spaces: How They Write Java at Google, Twitter, Mozilla and Pied Piper | Takipi Blog",Google's Cloud Machine Learning service is now in public beta,Cubr,The Java 8 API Design Principles,What Science Tells Us About Leadership Potential
156889606517612871,Multi-Channel Marketing in 2015 - It's not rocket science.,WeChat's competitor to Slack has arrived,Why Is Learning Drupal Hard?,"Deep Learning for Chatbots, Part 1 - Introduction","Amazon still crushing cloud competition, says Gartner Magic Quadrant for IaaS - TechRepublic",The surprising truth about which countries lead in digital
279771472506428952,5 Unique Features Of Google Compute Engine That No IaaS Provider Could Match,Google lags behind Amazon and Microsoft's cloud in one important area,Google's Cloud Dataflow stomps on Apache Spark in new benchmark tests,Bad Writing Is Destroying Your Company's Productivity,Graph Capabilities with the Elastic Stack,"Bots, Messenger and the future of customer service"
310515487419366995,71 erros de português que precisam sumir dos seus e-mails,This Super Accurate Portrait Selection Tech Uses Neural Networks,The barbell effect of machine learning.,Lists are the new search,WWDC 2016 preview: How to watch &amp; what to expect at Apple's event on Monday,"The New App Store: Subscription Pricing, Faster Approvals, and Search Ads"
319340024738595907,"contentId
319340024738595907    MITSUBISHI ASX 2.0 4X4 AWD 16V GASOLINA 4P AUT...
319340024738595907    MITSUBISHI ASX 2.0 4X4 AWD 16V GASOLINA 4P AUT...
Name: title, dtype: object",WWDC 2016 preview: How to watch &amp; what to expect at Apple's event on Monday,Lists are the new search,The barbell effect of machine learning.,360 million reasons to destroy all passwords - Free Code Camp,It's The Future
357449794379078687,Apple anuncia a 3ª geração da linguagem Swift para o final deste ano,Google may be considering Swift for use on Android,Alecrim/AlecrimCoreData,Apple Releases First Preview of Swift 3.0 for Developers,"Apple File System (APFS) announced for 2017, scales 'from Apple Watch to Mac Pro' and focuses on encryption",What Color is Your Function?
358192030955601318,A nova sede da LEGO na Dinamarca é toda sobre colaboração,A identidade visual de Budapeste para as Olimpíadas de 2024,Time to Re-Think Design Thinking,Git Large File Storage (Git LFS) now in Bitbucket Cloud - Bitbucket,Seniority,Salesforce Architect Journey
372531153711028286,DevOps requer profundas mudanças operacionais que o CIO precisa promover - CIO,"Docker - Build, Ship, and Run Any App, Anywhere",Nova regra do Banco Central pode significar o fim do Nubank; entenda - IDG Now!,Using Honcho to Create a Multi-Process Docker Container,Par de alianças impede que seu parceiro assista Netflix sem você,"DevOps security requires new mindset and tools for visibility, automation"
374352050712569304,O tênue equilíbrio da equipe que desenha produtos digitais,Usability Heuristics for Bots - Chatbots Magazine,Meet the new Brazilian consumer,Accenture amplia atuação no Brasil,Top 10 Intranet Trends of 2016,MOBILE TIME - FlyHelo: app permite compartilhamento de jatos e helicópteros em São Paulo
400125073514833994,Glamour Exclusive: President Obama On Feminism and The World He Wants to Leave His Daughters,Workplace diversity in Brazil: there's still a long way to go,Conheça 20 atletas LGBT que vão competir nas Olimpíadas do Rio,YouTube chama seus criadores de conteúdo para a campanha mundial #OrgulhoDeSer,"Para rebater Estatuto da Família, campanha muda significado de 'família' no Dicionário Houaiss",As expectativas das mulheres da Geração Y são muitas
428486625959995206,Most Interesting APIs in 2016: Cognitive Computing,15 Awesome Sublime Text Plugins For Web Development,Discutindo Devops na Prática,Chatbots: Are they better without the chat?,Machine Learning Is No Longer Just for Experts,Google lança YouTube Kids no Brasil | Google Discovery
430255078684584595,Google researchers teach AIs to see the important parts of images - and tell you about them,"Margaret Gould Stewart: How giant websites design for you (and a billion others, too)",Measuring email effectiveness in retail banking,Nubank começa a testar seu programa de fidelidade - Empresas Tech,Accidental discovery could help batteries last years longer,Making open source data more available
464601875539492971,Apenas US$ 59: Nintendo anuncia o relançamento do Nintendinho com 30 jogos na memória,Creating Compound Views on Android,The real reasons you procrastinate - and how to stop,Why Google App Engine rocks: A Google engineer's take,Why Kubernetes may be a bigger threat to Amazon than Google's cloud - TechRepublic,Infográfico: Algoritmos para Aprendizado de Máquina
511891900317865118,Why porting an iOS design to Android will not work,Decentralizing IoT networks through blockchain,Assista a entrevista de Linus Torvalds no TED legendada,Python Is Not Java (dirtSimple.org),Cracking the Job Interview with TensorFlow,Exploring Java's Hidden Costs
564282370384747453,Scrum Community - Scrum Alliance,Chat Smarter with Allo,Slack and Google announce partnership focused on better integrating their services,"Ser um bom líder depende de inúmeros fatores. Mas um deles, segundo o inglês Simon Sinek, é importantíssimo: a coragem para proteger as equipes e para arriscar quando necessário",The rise of APIs,The moment when you realize every server in the world is vulnerable - Free Code Camp
569574447134368517,Mastering Bash and Terminal,When to make a Git Commit,How to build cross-platform mobile apps using nothing more than a JSON markup,"What do you mean by ""Event-Driven""?",The Ten Commandments of Egoless Programming,15 minutos sobre Docker
607684800821303652,How This Former Google Engineer Is Bringing Blockchain to Banks,The future of the shopping mall,The Future of Digital Banking is Now,Como a Microsoft está trabalhando com o conceito de IoT - Startupi,Banking Needs a Customer Experience Wake-Up Call,The compelling case to replace a 40-year old core system - Chris Skinner's blog
621816023396605502,AI Is Here to Help You Write Emails People Will Actually Read,"Facebook Workplace officially launches on the web and iOS, set to compete head-on with Slack",Designing smart notifications,"Google acquires Synergyse, an interactive training service for Google Apps",Text summarization with TensorFlow,"Bots, Messenger and the future of customer service"
623421554979899217,Git Large File Storage (Git LFS) now in Bitbucket Cloud - Bitbucket,The Netflix Tech Blog: Engineering Trade-Offs and The Netflix API Re-Architecture,Salesforce Architect Journey,VMware Cloud™ on AWS - A Closer Look - frankdenneman.nl,Client-side ranking to more efficiently show people stories in feed,Announcing SyntaxNet: The World's Most Accurate Parser Goes Open Source
660451400045043370,Duolingo's chatbots help you learn a new language,Machine Learning Is No Longer Just for Experts,Bots won't replace apps. Better apps will replace apps.,Google lança YouTube Kids no Brasil | Google Discovery,Why Deep Learning Is Suddenly Changing Your Life,Chatbots: Are they better without the chat?
667643281369196267,Java Tools and Technologies Landscape Report 2016 | zeroturnaround.com,"Tabs vs Spaces: How They Write Java at Google, Twitter, Mozilla and Pied Piper | Takipi Blog","Incrível, Skype se lembrou que o Linux existe!",SOA com microserviços - Sensedia,Eclipse Foundation Releases Neon,15 Interesting JavaScript and CSS Libraries for October 2016
672199059798181601,Labelling automated builds on Docker Hub - Microscaling Systems,Ubuntu recebe suporte ao React Native e aplicativos de Android e iOS poderão chegar ao sistema,Sam Newman - Backends For Frontends,What Color is Your Function?,Leveling Up Your JavaScript -,Anti-If: The missing patterns
734632752661830332,Susan Wojcicki on the Effectiveness of Empowering Ads on YouTube,"Meet Bozoma Saint John, the Apple executive who stole the show at WWDC",9 Non-Threatening Leadership Strategies for Women,"Para rebater Estatuto da Família, campanha muda significado de 'família' no Dicionário Houaiss",Wide & Deep Learning: Better Together with TensorFlow,"Facebook Workplace officially launches on the web and iOS, set to compete head-on with Slack"
764116021156146784,"If you think women in tech is just a pipeline problem, you haven't been paying attention - Tech Diversity Files",Susan Wojcicki on the Effectiveness of Empowering Ads on YouTube,Google employees are adding 'Lady' to their job titles to fight sexism,O que é liderança? Liderança é fazer a diversidade funcionar.,De piada sobre TPM a servir cafezinho: como lidar com machismo no trabalho?,Criadas para casar
809601605585939618,​Microsoft and Canonical partner to bring Ubuntu to Windows 10 | ZDNet,A New Number Format for Computers Could Nuke Approximation Errors for Good,Java vs .NET vs Python vs Ruby vs Node.JS: Who Reigns the Job Market? | Takipi Blog,Announcing .NET Core 1.0,Containers are not VMs,JetBrains DataGrip: Your Swiss Army Knife for Databases and SQL
817145340976958200,Powering a more connected and collaborative enterprise,Google adiciona medidor de velocidade da internet nos resultados de pesquisa | Google Discovery,"Facebook Workplace officially launches on the web and iOS, set to compete head-on with Slack",Google's Cloud Machine Learning service is now in public beta,Machine Learning and the VP Debate,Inbox by Gmail ganha formatação de texto | Google Discovery
834896074125772354,So you want to sell to banks?,The economic essentials of digital strategy,55 fornecedores de TI que apresentarão novidades no Ciab 2016,Brazil's Banco Bradesco Joins R3 Consortium - CoinDesk,PwC faz virada digital e já fatura US$ 1 bilhão no mundo,The surprising truth about which countries lead in digital
880612740433495828,O que você deve fazer para se tornar um líder melhor?,How to augment your career with leadership coaching,"Ser um bom líder depende de inúmeros fatores. Mas um deles, segundo o inglês Simon Sinek, é importantíssimo: a coragem para proteger as equipes e para arriscar quando necessário",What Science Tells Us About Leadership Potential,Cinco competências comportamentais para você ser um bom líder,Psicóloga de Harvard diz que as pessoas julgam você em segundos por esses critérios | Jornal do Empreendedor
882422233694040097,Infográfico: Algoritmos para Aprendizado de Máquina,Why Google App Engine rocks: A Google engineer's take,Creating Compound Views on Android,The real reasons you procrastinate - and how to stop,The brilliant mechanics of Pokémon Go,The Developer's Midlife Crisis: What's Next?
911037455259135591,Burger King aceita pedidos via mensagens no Facebook - Startupi,Google lança experimentos com inteligência artificial | Google Discovery,Introduction · Bitcoin para Programadores,Google usa aprendizado de máquina para melhorar imagens de baixa qualidade | Google Discovery,Text summarization with TensorFlow,Live asynchronously.
