,If you read,Recommendation 1,Recommendation 2,Recommendation 3,Recommendation 4,Recommendation 5
4151147085496712967,Kubernetes,Graph Capabilities with the Elastic Stack,Aplicação de visão computacional com OpenCV,"Why Performance Matters, Part 1: The Perception Of Time - Smashing Magazine","Google acquires Synergyse, an interactive training service for Google Apps",5 Unique Features Of Google Compute Engine That No IaaS Provider Could Match
4164212115654350513,VMware Cloud™ on AWS - A Closer Look - frankdenneman.nl,The Netflix Tech Blog: Engineering Trade-Offs and The Netflix API Re-Architecture,Announcing SyntaxNet: The World's Most Accurate Parser Goes Open Source,An overview of web service solutions in Drupal 8,Introducing LambCI - a serverless build system,Git Large File Storage (Git LFS) now in Bitbucket Cloud - Bitbucket
4165127518659426948,The Netflix Tech Blog: Engineering Trade-Offs and The Netflix API Re-Architecture,VMware Cloud™ on AWS - A Closer Look - frankdenneman.nl,Announcing SyntaxNet: The World's Most Accurate Parser Goes Open Source,An overview of web service solutions in Drupal 8,Git Large File Storage (Git LFS) now in Bitbucket Cloud - Bitbucket,"Deep Learning for Chatbots, Part 2 - Implementing a Retrieval-Based Model in Tensorflow"
4184543400419595673,Este site quer conectar profissionais trans e travestis a empresas que não têm preconceito,"No dia das mães, Avon lança campanha com mãe de jovem gay",O homofóbico dentro de cada um,YouTube chama seus criadores de conteúdo para a campanha mundial #OrgulhoDeSer,Pabllo Vittar reina no novo comercial da Skol para os Jogos Olímpicos,"Para rebater Estatuto da Família, campanha muda significado de 'família' no Dicionário Houaiss"
4195778828921942020,The five phases of migrating to Google Cloud Platform,Leveling Up Your JavaScript -,Bringing easy and fast checkout with Payment Request API | Web Updates - Google Developers,The hardest thing in computer science,The Difference Between Sympathy And Empathy - Expanded Consciousness,Microservices Architecture on Google App Engine
4259370161044254504,"How I built an app with 500,000 users in 5 days on a $100 server",Here's proof that Google is getting serious about battling Facebook in a key area,You won't recognize the new world of digital payments without this report,Cross-channel user experiences with Drupal,Progressive Web App - first introduced on Google I/O | airberlin,WeChat's competitor to Slack has arrived
4277778562135834208,Beyond Progressive Web Apps Part 1,"Autofill: What web devs should know, but don't",Introduction to release engineering,WWDC 2016 preview: How to watch &amp; what to expect at Apple's event on Monday,The barbell effect of machine learning.,Learning How to Learn: The Most Important Developer Skill - Free Code Camp
4296604388230897073,"No ""Altas Horas"", garoto filho de casal homoafetivo dá lição contra a homofobia",Lilly Wachowski Makes First Public Appearance Since Coming Out as Transgender,Netflix emociona com vídeo destacando personagens LGBT,"No dia das mães, Avon lança campanha com mãe de jovem gay","TRF mantém resolução que proíbe ""cura gay"" - Jornal Opção",Tem hora certa pra sair do armário?
4300652811307550975,StrictMode for Runtime Analysis on Android - Google Developers,"Fresco, sim! - Android Dev BR",Programação Reativa Funcional com RxJava,Android Mobile Vision restores operation and adds Text API | Android Developers Blog,Android Developers Summer Reading List,Creating Compound Views on Android
4313871021753084020,Startups matam. E suas vítimas são as empresas que ainda não entendem o que é a Economia do Acesso,Mercado de Cosméticos no Brasil - Setor que não conhece crise!,Visual Thinking and Learning 3.0 working together at Walmart.com | Happy Melly,Pão de Açúcar tem rombo de R$ 512 milhões com fraude em e-commerce,Kotlin no Backend (Parte 2) :: Concrete Solutions,Introducing Kotlin support in Spring Framework 5.0
4369833742675497700,Transforming life insurance with design thinking,Why the customer experience matters,Embracing Agile,An operating model for company-wide agile development,The economic essentials of digital strategy,An operating model for company-wide agile development
4375556914674736641,Código Google: Introdução da próxima geração do Google Tag Manager e do Tag Manager 360 para Mobile Apps,"Incrível, Skype se lembrou que o Linux existe!",Java Tools and Technologies Landscape Report 2016 | zeroturnaround.com,Google Cloud Platform's preemptible VMs are now up to 33% cheaper,The return of the machinery question,Firebase and Google Cloud: better together
4383035933260676803,"Pedágio das rodovias estaduais de SP sobe 9,32% na sexta-feira - O Liberal",A New Number Format for Computers Could Nuke Approximation Errors for Good,One weird trick that will change the way you code forever: JavaScript TDD,The real reasons you procrastinate - and how to stop,Chat Smarter with Allo,8 Insanely Simple Productivity Hacks
4419562057180692966,Latin America's chronic inefficiency could drive more O2O commerce growth,Five questions boards should ask about IT in a digital world,MOBILE TIME - FlyHelo: app permite compartilhamento de jatos e helicópteros em São Paulo,Mobile marketing statistics 2016,Changing change management,Can Accenture Take Over Advertising?
4428409432282393251,Introduction · Bitcoin para Programadores,Burger King aceita pedidos via mensagens no Facebook - Startupi,Live asynchronously.,Google lança experimentos com inteligência artificial | Google Discovery,15 minutos sobre Docker,Eddy Cue and Craig Federighi Open Up About Learning From Apple's Failures
4485571547865864859,Bose's New Speaker Only Costs $150 But You Have to Build It Yourself,Google's Cloud Dataflow stomps on Apache Spark in new benchmark tests,The AI business landscape,11 Internet of Things (IoT) Protocols You Need to Know About,Comparing IoT Platforms: Compare 4 IoT platform for IoT projects,Cannes Lions 2016: Tecido tecnológico do Google leva GP de Product Design
4508362112182399467,Facebook's Artificial Intelligence Research lab releases open source fastText on GitHub,Google Cloud Platform's preemptible VMs are now up to 33% cheaper,You SHOULD Learn Vanilla JavaScript Before JS Frameworks - Snipcart,Criando ícones animados no Android,My favorite people and resources to learn Android programming from,Building Flipkart Lite: A Progressive Web App
4555339116751579515,Meet Aquifer: A build system for easier Drupal development,Lightning Distribution for Drupal: Build Advanced Authoring Experiences in Drupal 8,Dries Distributions remain a growing opportunity for Drupal - Buytaert,Dries Buytaert,Johnson & Johnson comprará grupo suíço por US$ 30 bi,"Google Pixel, o primeiro smartphone feito pelo Google | Google Discovery"
4577451034168098359,Cubr,"How to build a robot that ""sees"" with $100 and TensorFlow",Standing on the Shoulders of Giants - Built to Adapt,"Autofill: What web devs should know, but don't","CSP Is Dead, Long Live CSP! On the Insecurity of Whitelists and the Future of Content Security Policy","Zuul 2 : The Netflix Journey to Asynchronous, Non-Blocking Systems"
4579557799493615039,Google may be considering Swift for use on Android,Apple anuncia a 3ª geração da linguagem Swift para o final deste ano,Ordering coffee in Italy: the 10 commandments,The End Of Apple Man,Facebook's WhatsApp does something very different than Google,Why porting an iOS design to Android will not work
4629488036162962359,"Para rebater Estatuto da Família, campanha muda significado de 'família' no Dicionário Houaiss",Netflix emociona com vídeo destacando personagens LGBT,"No dia das mães, Avon lança campanha com mãe de jovem gay","Meet Bozoma Saint John, the Apple executive who stole the show at WWDC",YouTube chama seus criadores de conteúdo para a campanha mundial #OrgulhoDeSer,Pabllo Vittar reina no novo comercial da Skol para os Jogos Olímpicos
4716135688735489427,"No dia das mães, Avon lança campanha com mãe de jovem gay",YouTube chama seus criadores de conteúdo para a campanha mundial #OrgulhoDeSer,"Para rebater Estatuto da Família, campanha muda significado de 'família' no Dicionário Houaiss",Este site quer conectar profissionais trans e travestis a empresas que não têm preconceito,O homofóbico dentro de cada um,"TRF mantém resolução que proíbe ""cura gay"" - Jornal Opção"
4744297321841608877,containerd - a core container runtime project for the industry - Docker Blog,The Ten Commandments of Egoless Programming,Alecrim/AlecrimCoreData,Mastering Bash and Terminal,Blaise Agüera y Arcas: How computers are learning to be creative,The Ultimate Solution to Versioning REST APIs: Content Negotiation
4761910285123871012,Bot Engine,Facebook's WhatsApp does something very different than Google,Meet Aquifer: A build system for easier Drupal development,2 terrific #MarTech talks on the rise of AI in marketing - Chief Marketing Technologist,Bots won't replace apps. Better apps will replace apps.,A New Number Format for Computers Could Nuke Approximation Errors for Good
4774970687540378081,The economic essentials of digital strategy,Meet the new Brazilian consumer,PwC faz virada digital e já fatura US$ 1 bilhão no mundo,55 fornecedores de TI que apresentarão novidades no Ciab 2016,Mobile Time,How to Create an Exponential Mindset
4785499183287168509,The new tech talent you need to succeed in digital,The economic essentials of digital strategy,How to Create an Exponential Mindset,Assessing Salesforce's platform and ecosystem | ZDNet,Meet the new Brazilian consumer,We are on the verge of a consumer M&A avalanche
4788854083489560153,Node.js Examples - How Enterprises use Node in 2016 | @RisingStack,Cordova iOS Performance Improvements: Drop-in Speed with WKWebView,Bitbucket Pipelines Beta: continuous delivery inside Bitbucket - Bitbucket,What's the Best Programming Language to Learn in 2017?,The Children's Illustrated Guide to Kubernetes,Bayer anuncia compra da Monsanto por US$ 66 bilhões
4814419120794996930,"Netflix says Geography, Age, and Gender are ""Garbage"" for Predicting Taste",The Future of Business is Design,Introduction to Natural Language Processing - University of Michigan | Coursera,The return of the machinery question,Facebook says its new AI is almost as good as humans at understanding context,You won't recognize the new world of digital payments without this report
4815632823882298534,"Por dentro do Nubank, conheça os segredos da fintech mais festejada do país","No, Apple isn't the next BlackBerry - it's the next Microsoft","Google Slides incorpora recurso de ""perguntas e respostas"" em tempo real | Google Discovery",The next wave in software is open adoption software,Slack and Google announce partnership focused on better integrating their services,Governo brasileiro cria manual para contratação de cloud
4876769046116846438,Shopping em BH terá fazenda urbana de 2.700 m²,"Para rebater Estatuto da Família, campanha muda significado de 'família' no Dicionário Houaiss",Glamour Exclusive: President Obama On Feminism and The World He Wants to Leave His Daughters,Workplace diversity in Brazil: there's still a long way to go,Ciclistas relatam roubos com agressividade na avenida dos Andradas,As expectativas das mulheres da Geração Y são muitas
4891010769166501207,Introducing Kotlin support in Spring Framework 5.0,"Tabs vs Spaces: How They Write Java at Google, Twitter, Mozilla and Pied Piper | Takipi Blog",Spring Boot 1.5.1 released,Startups matam. E suas vítimas são as empresas que ainda não entendem o que é a Economia do Acesso,Java vs .NET vs Python vs Ruby vs Node.JS: Who Reigns the Job Market? | Takipi Blog,Kotlin no Backend (Parte 2) :: Concrete Solutions
4893900714822288649,[Article] Poka Yoke: o que é e como implementar | Endeavor Brasil,"Google lança Science Journal, aplicativo de ciências para Android | Google Discovery","5 awesome Google Keep features you aren't using, but should be",[E-learning] Design Thinking for Innovation - University of Virginia | Coursera,Design Sprint: onde o design e a velocidade importam,[Tools] A Tool for tracking Kanban projects (that you can cut out and keep) - Emily Webber
4911701623098526999,Why image recognition is about to transform business,This startup uses machine learning and satellite imagery to predict crop yields,Goodbye accountants! Startup builds AI to automate all your accounting,Why the customer experience matters,Algorithms and architecture for job recommendations,Is FinTech Forcing Banking to a Tipping Point?
5008913705695203000,Post: Just Say mNo to Hungarian Notation,Alecrim/AlecrimCoreData,Dark Scrum,"Autofill: What web devs should know, but don't",bliki: StranglerApplication,Facebook's WhatsApp does something very different than Google
5018472516978866574,The Internet of Things is looking for its VisiCalc,Blaise Agüera y Arcas: How computers are learning to be creative,Cubr,Visa e Swatch lançam relógio para pagamentos contactless no Brasil - Startupi,Up your app's sharing game with DirectShare - Google Developers,"Autofill: What web devs should know, but don't"
5037221949349729844,Susan Wojcicki on the Effectiveness of Empowering Ads on YouTube,"If you think women in tech is just a pipeline problem, you haven't been paying attention - Tech Diversity Files",Cookbook,De piada sobre TPM a servir cafezinho: como lidar com machismo no trabalho?,O dia em que tive mais medo de estar errada.,Google employees are adding 'Lady' to their job titles to fight sexism
5045927063019110283,Amazon causa polêmica com serviço que faz entregas em 1 hora em Paris,Não existe frete grátis!,As compras e os hábitos dos brasileiros no shopping | EXAME.com,Cia. Hering sincroniza diferentes marcas em um único portal de compras,From E-Commerce to Web 3.0: Let the Bots Do the Shopping,Mercado de Cosméticos no Brasil - Setor que não conhece crise!
5087084654882097891,"Google Pixel, o primeiro smartphone feito pelo Google | Google Discovery",Google adiciona medidor de velocidade da internet nos resultados de pesquisa | Google Discovery,Meet Aquifer: A build system for easier Drupal development,Dries Distributions remain a growing opportunity for Drupal - Buytaert,Ouça a música criada pela inteligência artificial do Google | Google Discovery,Lightning Distribution for Drupal: Build Advanced Authoring Experiences in Drupal 8
5088013394045185972,JavaScript Conquered the Web. Now It's Taking Over the Desktop,How I sped up the initial render of my Polymer app by 86%,Acesse a versão Material Design do YouTube | Google Discovery,Ubuntu recebe suporte ao React Native e aplicativos de Android e iOS poderão chegar ao sistema,Modelando APIs REST com Swagger,The Business Case for Progressive Web Apps
5092635400707338872,Power to the People: How One Unknown Group of Researchers Holds the Key to Using AI to Solve Real...,"DARPA Goes ""Meta"" with Machine Learning for Machine Learning",Programming by poking: why MIT stopped teaching SICP,"Hello, TensorFlow!","Say goodbye to traditional customer segmentation "" Banking Technology",It's The Future
5206308811707978799,The rise of APIs,The return of the machinery question,"No, Apple isn't the next BlackBerry - it's the next Microsoft",Mobile marketing statistics 2016,A digital crack in banking's business model,"Coca-Cola é 1ª da lista ""Fortune"" a repor toda a água usada | EXAME.com"
5211673327552264703,Google Cloud Platform sets a course for new horizons,Why Evernote Is Giving Up on Its Data Centers for Google Cloud,"Google Pixel, o primeiro smartphone feito pelo Google | Google Discovery",Google adiciona medidor de velocidade da internet nos resultados de pesquisa | Google Discovery,Google is quietly recording everything you say. Here's how to hear it,Assista a entrevista de Linus Torvalds no TED legendada
5217724704513784613,You SHOULD Learn Vanilla JavaScript Before JS Frameworks - Snipcart,Building Flipkart Lite: A Progressive Web App,"How to build a robot that ""sees"" with $100 and TensorFlow",Building a Team from the Inside Out: Alok Gupta on the Evolution of Data Science at Airbnb,Advanced Android Espresso,Facebook's Artificial Intelligence Research lab releases open source fastText on GitHub
5227822864949117283,The Difference Between Sympathy And Empathy - Expanded Consciousness,Why the customer experience matters,"5 awesome Google Keep features you aren't using, but should be",The return of the machinery question,Lean IT is all about people - o Lean na TI é focado em pessoas,Shopping app Spring's redesign could be a game-changer
5238119115012015307,Embracing Agile,Accenture amplia atuação no Brasil,Running GV sprints inside corporates - learn from my mistakes - Sprint Stories,Power to the People: How One Unknown Group of Researchers Holds the Key to Using AI to Solve Real...,"DARPA Goes ""Meta"" with Machine Learning for Machine Learning","Say goodbye to traditional customer segmentation "" Banking Technology"
5258604889412591249,Machine Learning Is No Longer Just for Experts,Google lança YouTube Kids no Brasil | Google Discovery,Chatbots: Are they better without the chat?,15 Awesome Sublime Text Plugins For Web Development,Blaise Agüera y Arcas: How computers are learning to be creative,19 Tips For Everyday Git Use
5263606973029607223,"Building A Modern, Scalable Backend: Modernizing Monolithic Applications",Creating Your Code Review Checklist - DaedTech,Cloud Native Part 1: Definition,"Zuul 2 : The Netflix Journey to Asynchronous, Non-Blocking Systems",Angular 2 versus React: There Will Be Blood - Free Code Camp,Serverless real-time architecture on AWS: there is a way !
5270696484536580646,8 Insanely Simple Productivity Hacks,"5 awesome Google Keep features you aren't using, but should be",How the queen of Silicon Valley is helping Google go after Amazon's most profitable business,The return of the machinery question,Google researchers teach AIs to see the important parts of images - and tell you about them,Google is quietly recording everything you say. Here's how to hear it
5293701842202310496,Can Accenture Take Over Advertising?,"An independent organization just ranked Google as the best cloud, beating Amazon",You won't recognize the new world of digital payments without this report,Meet the new Brazilian consumer,Bradesco e Visa anunciam pulseira que substitui cartão | EXAME.com,Is FinTech Forcing Banking to a Tipping Point?
5302085907556673015,Google employees are adding 'Lady' to their job titles to fight sexism,"If women in tech stop apologizing, we might just be able to shut the sexist shit down. - Athena Talks","If you think women in tech is just a pipeline problem, you haven't been paying attention - Tech Diversity Files","Meet Bozoma Saint John, the Apple executive who stole the show at WWDC","The code that took America to the moon was just published to GitHub, and it's like a 1960s time capsule",This Super Accurate Portrait Selection Tech Uses Neural Networks
5313335392004163852,Salesforce Architect Journey,Client-side ranking to more efficiently show people stories in feed,Git Large File Storage (Git LFS) now in Bitbucket Cloud - Bitbucket,Blaise Agüera y Arcas: How computers are learning to be creative,Seniority,The Developer's Midlife Crisis: What's Next?
5328558001212551235,Acquia Engage Awards Finalists Announced,Why Is Learning Drupal Hard?,The Death of Drupal Commerce as an Ecommerce Solution - Third & Grove,Dries Distributions remain a growing opportunity for Drupal - Buytaert,Dries Buytaert,Lightning Distribution for Drupal: Build Advanced Authoring Experiences in Drupal 8
5336562616168017846,"Enterprises fighting back, Spring Boot is the best, and other SpringOne Platform takeaways",On DRY and the cost of wrongful abstractions,Facebook's Artificial Intelligence Research lab releases open source fastText on GitHub,Angular 2 versus React: There Will Be Blood - Free Code Camp,Sobre o Hipsters Ponto Tech,Kotlin no Backend (Parte 2) :: Concrete Solutions
5338677278233757627,How to Get a Job at Google,"Coca-Cola é 1ª da lista ""Fortune"" a repor toda a água usada | EXAME.com",Inbox by Gmail ganha formatação de texto | Google Discovery,Staying one step ahead at Pixar: An interview with Ed Catmull,"Microsoft adquire LinkedIn por US$ 26,2 bilhões",Coca-Cola Is Paying $575 Million for Unilever's Soy Drink Business
5424502143558028097,Sam Newman - Backends For Frontends,What Color is Your Function?,Robert Waldinger: Do que é feita uma vida boa? Lições do mais longo estudo sobre felicidade,Lists are the new search,4 Reasons Managers Should Spend More Time on Coaching,WWDC 2016 preview: How to watch &amp; what to expect at Apple's event on Monday
5429045128339158843,Spring Boot 1.5.1 released,Introducing Kotlin support in Spring Framework 5.0,Microservices - When to React Vs. Orchestrate - Capital One DevExchange,The Ultimate Solution to Versioning REST APIs: Content Negotiation,Arquitetura de Microserviços habilitando APIs - Sensedia,When to make a Git Commit
5445999759138709405,Bradesco lança serviço inédito para estimular o hábito de poupar,CMN regulamenta abertura de conta de depósito por meio eletrônico,Starbucks tem mais dinheiro do cliente em cartões do que bancos,Abrimos uma conta no Original.,The compelling case to replace a 40-year old core system - Chris Skinner's blog,XP quer ter banco no Brasil e vai abrir escritório em Genebra este mês
5484061377044071389,The Ultimate Solution to Versioning REST APIs: Content Negotiation,Hype Driven Development,Microservices - When to React Vs. Orchestrate - Capital One DevExchange,What to Inspect When You are Inspecting!,Sam Newman - Backends For Frontends,Communication patterns in a Microservice world
5530820581773167955,Mulheres são mais criativas que homens?,"Para rebater Estatuto da Família, campanha muda significado de 'família' no Dicionário Houaiss",O que é liderança? Liderança é fazer a diversidade funcionar.,De piada sobre TPM a servir cafezinho: como lidar com machismo no trabalho?,A importância dos filmes de mulherzinha - Capitolina,"Por dentro do MariaLab: A tecnologia é área para as mulheres, sim!"
5533752987392101383,7 Questions to Ask Before Your Next Digital Transformation,Google cloud boss Diane Greene: We're winning against AWS and Microsoft,Two Different Sales Motions . . . .,Scala is the new golden child,Banking Needs a Customer Experience Wake-Up Call,The sales secrets of high-growth companies
5658521282502533116,ITA está oferecendo 10 cursos gratuitos a distância - Engenharia é:,Como Usar o Git e o GitHub,Sua comunidade de Teste.,Agile: Falta competência nos testes,BDD Best Practices and Guidelines - Testing Excellence,Dicas avançadas de ruby (capybara/cucumber)
5688279681867464747,"Margaret Gould Stewart: How giant websites design for you (and a billion others, too)",Measuring email effectiveness in retail banking,Google researchers teach AIs to see the important parts of images - and tell you about them,Nubank começa a testar seu programa de fidelidade - Empresas Tech,Accidental discovery could help batteries last years longer,Will blockchain drive the fourth Industrial Revolution?
5719793245136119929,Cade autoriza Itaú Unibanco e Mastercard a criarem nova bandeira de cartão,Banco desafia empreendedores e estudantes de tecnologia a buscarem inovação para processos | EXAME.com,Visa lança desafio para startups de tecnologia - Startupi,CMN regulamenta abertura de conta de depósito por meio eletrônico,Starbucks tem mais dinheiro do cliente em cartões do que bancos,The sales secrets of high-growth companies
5787934590133549357,Ouça a música criada pela inteligência artificial do Google | Google Discovery,Google is quietly recording everything you say. Here's how to hear it,Google adiciona medidor de velocidade da internet nos resultados de pesquisa | Google Discovery,"Google Pixel, o primeiro smartphone feito pelo Google | Google Discovery",Why image recognition is about to transform business,Machine Learning Is At The Very Peak Of Its Hype Cycle - ARC
5795281877636738272,Microsoft's Open Source Love Affair Reaches New Heights,Alecrim/AlecrimCoreData,The next wave in software is open adoption software,Our password hashing has no clothes,Decentralizing IoT networks through blockchain,"Hello, TensorFlow!"
5816734694927565572,Bot Design Patterns,The next wave in software is open adoption software,Google may be considering Swift for use on Android,Bradesco vai testar tecnologia por trás do bitcoin em São Paulo,How bot-to-bot could soon replace APIs,"Apple File System (APFS) announced for 2017, scales 'from Apple Watch to Mac Pro' and focuses on encryption"
5847042211895226591,Elastic Stack 5.0.0 Released,"CSP Is Dead, Long Live CSP! On the Insecurity of Whitelists and the Future of Content Security Policy",gotwarlost/istanbul,Building Spring Cloud Microservices That Strangle Legacy Systems,Microservices - When to React Vs. Orchestrate - Capital One DevExchange,Standing on the Shoulders of Giants - Built to Adapt
5849490334294127641,gotwarlost/istanbul,"Tabs vs Spaces: How They Write Java at Google, Twitter, Mozilla and Pied Piper | Takipi Blog",A Googler analyzed a billion files to settle the programming dispute made famous by HBO's 'Silicon Valley',"GitLab launches Issue Boards, an open-source task management tool that resembles Trello",Closure Compiler in JavaScript,The technology behind preview photos
5854206600849997966,The hardest thing in computer science,The Importance of Code Reviews,"Autofill: What web devs should know, but don't",Learning How to Learn: The Most Important Developer Skill - Free Code Camp,Joel on Software,"Meet Mycroft, the open source AI who wants to rival Siri, Cortana, and Alexa | ZDNet"
